title,category,author,date,source,url,summary
"GLP-1 Drugs Studied for Potential to Treat Addiction and Compulsive Behaviors",Health,"Yasemin Saplakoglu",2024-01-30,STAT News,"https://www.statnews.com/2024/01/30/glp1-drugs-ozempic-addiction-compulsive-behavior/","Beyond weight loss, researchers are now investigating whether drugs like Ozempic and Wegovy can curb cravings and reduce addictive behaviors related to alcohol, nicotine, and gambling."
"New Blood Test Could Predict Preeclampsia Risk in Pregnant Women",Health,"Jen Christensen",2024-01-29,CNN Health,"https://www.cnn.com/2024/01/29/health/preeclampsia-blood-test-pregnancy/index.html","The FDA has cleared a new blood test that can help doctors identify pregnant women at high risk of developing preeclampsia, a dangerous high-blood-pressure condition."
"The Promise and Peril of At-Home Medical Testing Kits",Health,"Rachel Fairbank",2024-01-28,The Wall Street Journal,"https://www.wsj.com/articles/at-home-medical-testing-kits-promise-peril","The market for direct-to-consumer health tests for everything from food sensitivity to hormones is booming, but experts caution about the lack of regulation and potential for misinterpretation."
"Hospitals Overwhelmed by 'Boarding' Crisis as Psychiatric Bed Shortage Worsens",Health,"Anna Gorman",2024-01-27,Kaiser Health News (KHN),"https://khn.org/news/article/hospitals-boarding-crisis-psychiatric-bed-shortage/","Patients experiencing a mental health crisis are being held ('boarded') in emergency rooms for days or weeks due to a severe nationwide shortage of inpatient psychiatric beds."
"Regular Napping Linked to Higher Risk of High Blood Pressure and Stroke",Health,"Katie Hunt",2024-01-26,CNN,"https://www.cnn.com/2024/01/26/health/napping-high-blood-pressure-stroke-risk-wellness/index.html","A large study published by the American Heart Association found that frequent, long naps were associated with a greater likelihood of developing hypertension and having a stroke."
"Scientists Grow Human Embryo Models Without Sperm or Egg, Raising Ethical Questions",Health,"Megan Molteni",2024-01-25,STAT News,"https://www.statnews.com/2024/01/25/human-embryo-models-sperm-egg-stem-cells/","Researchers have created synthetic human embryo-like structures from stem cells that mimic the earliest stages of development, a breakthrough that also prompts a new debate on bioethics."
"Congress Averts Government Shutdown with Last-Minute Stopgap Bill",Politics,"Carl Hulse",2024-02-28,The New York Times,"https://www.nytimes.com/2024/02/28/politics/congress-government-shutdown-stopgap-bill.html","Lawmakers passed a short-term funding measure just hours before a deadline, temporarily avoiding a partial government shutdown but setting up another fiscal cliff in several weeks."
"FTC Sues to Block Major Supermarket Merger, Citing Antitrust Concerns",Politics,"David McLaughlin",2024-02-26,Bloomberg,"https://www.bloomberg.com/news/articles/2024-02-26/ftc-sues-to-block-kroger-albertsons-merger","The Federal Trade Commission filed a lawsuit to stop the proposed $24.6 billion merger between Kroger and Albertsons, arguing the deal would lead to higher food prices for consumers and harm workers."
"US and UK Launch Coordinated Airstrikes Against Houthi Targets in Yemen",Politics,"Nancy A. Youssef",2024-02-24,"The Wall Street Journal","https://www.wsj.com/articles/us-uk-launch-airstrikes-houthi-targets-yemen-red-sea","In response to ongoing attacks on international shipping, U.S. and British forces conducted a new round of strikes on Houthi military sites, aiming to degrade the group's capabilities."
"Presidential Primary Debate Focuses on Economy and Foreign Policy",Politics,"Seung Min Kim",2024-02-22,Associated Press,"https://apnews.com/article/presidential-primary-debate-economy-foreign-policy-2024-02","Candidates clashed over inflation, national debt, and America's role in global conflicts during the latest televised debate, seeking to differentiate themselves ahead of key primary contests."
"State Department Issues 'Level 4: Do Not Travel' Advisory for Haiti Amidst Gang Violence",Politics,"Michael Weissenstein",2024-02-21,Associated Press,"https://apnews.com/article/haiti-travel-advisory-gang-violence-state-department-2024-02","The U.S. government has urged all American citizens to leave Haiti immediately, citing extreme kidnapping risks and the near-total collapse of security as armed gangs control large parts of the capital."
"Bipartisan TikTok Divestment Bill Gains Momentum in the House",Politics,"David Shepardson",2024-02-20,Reuters,"https://www.reuters.com/technology/bipartisan-tiktok-divestment-bill-gains-momentum-house-2024-02-20/","A bill that would force TikTok's Chinese parent company, ByteDance, to sell the app or face a U.S. ban is rapidly advancing with support from both Democrats and Republicans over national security concerns."
"Supreme Court Appears Skeptical of State Laws Regulating Social Media Content",Politics,"Adam Liptak",2024-02-19,The New York Times,"https://www.nytimes.com/2024/02/19/us/politics/supreme-court-social-media-content-laws.html","During oral arguments, justices from across the ideological spectrum questioned the constitutionality of laws in Texas and Florida that seek to limit how social media platforms moderate content."
"Pentagon Fails its Sixth Consecutive Audit, Unable to Account for Half its Assets",Politics,"Tony Capaccio",2024-02-17,Bloomberg,"https://www.bloomberg.com/news/articles/2024-02-17/pentagon-fails-sixth-audit-unable-to-account-for-assets","The Department of Defense has once again failed its annual audit, highlighting ongoing systemic issues with financial tracking and accountability for trillions of dollars in assets."
"Germany's Ruling Coalition in Disarray Over Ukraine Military Aid",Politics,"Erika Solomon",2024-02-16,The New York Times,"https://www.nytimes.com/2024/02/16/world/europe/germany-ukraine-taurus-missiles.html","Chancellor Olaf Scholz is facing intense pressure from his coalition partners and allies to send long-range Taurus missiles to Ukraine, a move he has so far resisted, creating deep rifts in his government."
"US-EU Trade Tensions Resurface Over Steel and Aluminum Tariffs",Politics,"Shawn Donnan",2024-02-15,Bloomberg,"https://www.bloomberg.com/news/articles/2024-02-15/us-eu-trade-tensions-steel-aluminum-tariffs","Negotiations between the United States and the European Union to resolve a dispute over metal tariffs have stalled, raising the prospect of a renewed trade war that could impact billions in goods."
"Florida Legislature Passes Controversial Bill Restricting School Library Books",Politics,"Ana Ceballos",2024-02-14,Miami Herald,"https://www.miamiherald.com/news/politics-government/state-politics/article285412345.html","The state legislature approved a bill that makes it easier for parents to challenge books in school libraries, a move critics say amounts to censorship and targets LGBTQ+ and minority authors."
"Senate Intelligence Committee Warns of Russian Interference in 2024 Election",Politics,"Julian E. Barnes",2024-02-13,The New York Times,"https://www.nytimes.com/2024/02/13/us/politics/senate-intelligence-russia-election-interference.html","In its annual threat assessment, the committee stated that Russia remains a critical and persistent threat, using disinformation campaigns and cyber operations to sow discord and influence U.S. elections."
"White House Announces New Sanctions on Iran Over its Drone Program",Politics,"John Hudson",2024-02-12,The Washington Post,"https://www.washingtonpost.com/national-security/2024/02/12/white-house-iran-sanctions-drones/","The Biden administration imposed new economic sanctions targeting individuals and entities involved in Iran's drone manufacturing, which has supplied unmanned aerial vehicles to Russia for use in Ukraine."
"Debate Over Foreign Aid for Ukraine Divides Republican Party",Politics,"Jake Sherman",2024-02-11,Punchbowl News,"https://punchbowl.news/article/ukraine-foreign-aid-republican-divide/","A supplemental funding package for Ukraine, Israel, and Taiwan is facing significant opposition from a faction of House Republicans, highlighting a growing isolationist sentiment within the party."
"Federal Court Strikes Down Alabama's Congressional Map for Diluting Black Vote",Politics,"Ariane de Vogue",2024-02-09,CNN,"https://www.cnn.com/2024/02/09/politics/alabama-congressional-map-supreme-court/index.html","A panel of federal judges rejected Alabama's newly drawn congressional map, ruling that it likely violates the Voting Rights Act by failing to create a second majority-Black district."
"Presidential Executive Order Aims to Bolster U.S. Supply Chain Resilience",Politics,"Ana Swanson",2024-02-08,The New York Times,"https://www.nytimes.com/2024/02/08/business/economy/biden-supply-chain-executive-order.html","The president signed an executive order directing federal agencies to conduct a 100-day review of critical supply chains for semiconductors, pharmaceuticals, and rare-earth minerals."
"South Africa's Ruling ANC Party Faces Toughest Election Challenge Since Apartheid",Politics,"John Eligon",2024-02-07,The New York Times,"https://www.nytimes.com/2024/02/07/world/africa/south-africa-anc-election.html","Polls indicate that the African National Congress could lose its parliamentary majority for the first time since Nelson Mandela's victory in 1994, amid voter frustration over corruption and a weak economy."
"US-China Diplomatic Talks Resume, Aiming to Stabilize Tense Relationship",Politics,"Edward Wong",2024-02-06,The New York Times,"https://www.nytimes.com/2024/02/06/us/politics/us-china-diplomatic-talks.html","High-level officials from Washington and Beijing met for candid discussions on a range of contentious issues, including trade, Taiwan, and fentanyl, in an effort to manage competition and prevent conflict."
"Student Loan Forgiveness Plan Faces New Legal Challenges from Republican States",Politics,"Collin Binkley",2024-02-05,Associated Press,"https://apnews.com/article/student-loan-forgiveness-legal-challenges-biden-2024-02","A coalition of Republican-led states has filed a new lawsuit seeking to block the Biden administration's latest student debt relief plan, arguing it oversteps executive authority."
"The Geopolitics of the Arctic: Nations Vie for Control as Ice Melts",Politics,"Paul Sonne",2024-02-04,The New York Times,"https://www.nytimes.com/2024/02/04/world/europe/arctic-geopolitics-russia-nato.html","With climate change opening new shipping lanes and access to resources, the Arctic is becoming a new front for strategic competition between Russia, China, and NATO allies."
"House Ethics Committee Launches Investigation into Lawmaker's Stock Trades",Politics,"Melanie Zanona",2024-02-02,CNN,"https://www.cnn.com/2024/02/02/politics/house-ethics-committee-stock-trade-investigation/index.html","The bipartisan ethics panel has opened a formal inquiry into a member of Congress over allegations of using nonpublic information to make timely stock trades in the defense sector."
"EPA Finalizes Stricter Rules on Soot Pollution to Improve Public Health",Politics,"Dino Grandoni",2024-02-01,The Washington Post,"https://www.washingtonpost.com/climate-environment/2024/02/01/epa-soot-pollution-rules/","The Environmental Protection Agency announced a new, more stringent standard for fine particulate matter (soot), a move the agency says will prevent thousands of premature deaths annually."
"Immigration Reform Talks Collapse in Senate Amid Partisan Finger-Pointing",Politics,"Burgess Everett",2024-01-31,Politico,"https://www.politico.com/news/2024/01/31/senate-immigration-reform-talks-collapse","A month-long bipartisan effort to craft a deal on border security and immigration reform has fallen apart, dashing hopes for a legislative solution to the crisis at the southern border."
"Japan's Prime Minister Grapples with Political Funding Scandal",Politics,"Michelle Ye Hee Lee",2024-01-30,The Washington Post,"https://www.washingtonpost.com/world/2024/01/30/japan-kishida-scandal-ldp/","Prime Minister Fumio Kishida's approval ratings have plummeted as a widening fundraising scandal engulfs his ruling Liberal Democratic Party, leading to the arrest of several lawmakers."
"Department of Homeland Security Designates AI as a Critical National Security Risk",Politics,"Ellen Nakashima",2024-01-29,The Washington Post,"https://www.washingtonpost.com/national-security/2024/01/29/dhs-ai-national-security-risk/","DHS has released a new strategy document outlining the potential for adversaries to use artificial intelligence for cyberattacks, disinformation campaigns, and the creation of chemical weapons."
"The Role of 'Dark Money' in Judicial Nominations Comes Under Scrutiny",Politics,"Heidi Przybyla",2024-01-27,Politico,"https://www.politico.com/news/2024/01/27/dark-money-judicial-nominations-scrutiny","Senate Democrats are holding hearings on the influence of undisclosed donations to nonprofit groups that advocate for and against federal judicial nominees."
"Farmers Across Europe Protest Against EU Green Policies and Cheap Imports",Politics,"Matina Stevis-Gridneff",2024-01-26,Financial Times,"https://www.ft.com/content/european-farmers-protest-eu-green-deal","Convoys of tractors have blocked highways in France, Germany, and Belgium as farmers protest against environmental regulations, rising costs, and what they say is unfair competition from Ukrainian imports."
"US Postal Service Modernization Plan Faces Bipartisan Opposition in Congress",Politics,"Jacob Bogage",2024-01-25,The Washington Post,"https://www.washingtonpost.com/business/2024/01/25/usps-dejoy-modernization-plan-congress/","Postmaster General Louis DeJoy's 10-year overhaul plan is facing criticism from lawmakers on both sides of the aisle over mail delivery delays and the consolidation of processing facilities."
"Mexican President's Proposed Constitutional Reforms Spark Controversy",Politics,"Dave Graham",2024-01-24,Reuters,"https://www.reuters.com/world/americas/mexican-presidents-constitutional-reforms-spark-controversy-2024-01-24/","President Andrés Manuel López Obrador has proposed sweeping changes to Mexico's constitution, including an overhaul of the judiciary, which critics warn would erode democratic checks and balances."
"The Filibuster Debate Reignites in the Senate as Gridlock Persists",Politics,"Sahil Kapur",2024-01-23,NBC News,"https://www.nbcnews.com/politics/congress/filibuster-debate-reignites-senate-gridlock-persists-rcna135246","With major legislation stalled, progressive Democrats are once again calling for an end to the Senate's 60-vote threshold, arguing it is an obstacle to passing key priorities."
"US Re-designates Houthis as a Terrorist Organization",Politics,"Missy Ryan",2024-01-22,The Washington Post,"https://www.washingtonpost.com/national-security/2024/01/22/us-houthis-terrorist-designation/","The Biden administration has formally relisted Yemen's Houthi rebels as a 'Specially Designated Global Terrorist' group, a move that triggers sanctions but includes carve-outs for humanitarian aid."
"State Legislatures Increasingly Use Preemption Laws to Overrule Local Ordinances",Politics,"Reid Wilson",2024-01-20,The Hill,"https://thehill.com/homenews/state-watch/4412345-state-preemption-laws-overrule-local-ordinances/","A growing trend sees state governments passing broad laws that prevent cities and counties from enacting their own policies on issues ranging from minimum wage to environmental protection."
"North Korea Abandons Goal of Reconciliation with South, Declares It 'Enemy State'",Politics,"Choe Sang-Hun",2024-01-19,The New York Times,"https://www.nytimes.com/2024/01/19/world/asia/north-korea-south-reconciliation.html","Kim Jong Un has formally rejected the long-standing goal of peaceful reunification with South Korea, ordering the demolition of monuments to inter-Korean cooperation and escalating military tensions."
"The CBO's Dire Long-Term Budget Outlook: A Ticking Debt Bomb",Politics,"Heather Long",2024-01-18,The Washington Post,"https://www.washingtonpost.com/us-policy/2024/01/18/cbo-budget-outlook-debt/","The Congressional Budget Office released its latest projections, warning that the national debt is on an unsustainable path, projected to reach a record 116% of GDP within a decade."
"Biden Administration Restores Endangered Species Act Protections",Politics,"Lisa Friedman",2024-01-17,The New York Times,"https://www.nytimes.com/2024/01/17/climate/biden-endangered-species-act.html","The Interior Department finalized rules that reverse Trump-era changes, restoring longstanding protections for threatened species and once again considering climate change as a factor in listing decisions."