title,category,author,date,source,url,summary
"Starbucks and Union Agree to Framework for Contract Negotiations",Business,"Dee-Ann Durbin",2024-02-28,Associated Press,"https://apnews.com/article/starbucks-union-negotiations-framework-2024-02","In a significant breakthrough, Starbucks and the Workers United union have agreed to a process to negotiate contracts, potentially paving the way to resolve a years-long, contentious labor dispute."
"The 'Buy Now, Pay Later' Industry Faces a Reckoning as Regulators Circle",Business,"Ananya Bhattacharya",2024-02-27,Quartz,"https://qz.com/buy-now-pay-later-industry-regulation-reckoning-1851289123","BNPL services like Klarna and Affirm are facing increased scrutiny from consumer protection agencies over concerns about hidden fees and the risk of spiraling debt for users."
"US Manufacturing Construction Surges, Fueled by CHIPS Act and IRA",Business,"Josh Wingrove",2024-02-26,Bloomberg,"https://www.bloomberg.com/news/articles/2024-02-26/us-manufacturing-construction-surges-on-chips-act-ira","Federal incentives from the CHIPS Act and Inflation Reduction Act have ignited a factory-building boom across the United States, particularly for semiconductors and electric vehicle batteries."
"Private Equity Dealmaking Slumps Amid High Interest Rates and Uncertainty",Business,"Antoine Gara",2024-02-25,"The Wall Street Journal","https://www.wsj.com/articles/private-equity-dealmaking-slumps-high-interest-rates","The volume of private equity buyouts has fallen sharply as expensive debt and valuation disagreements between buyers and sellers have created a challenging environment for dealmakers."
"The Space Economy: Startups Race to Build the Next Generation of Satellites",Business,"Michael Sheetz",2024-02-24,CNBC,"https://www.cnbc.com/2024/02/24/space-economy-satellite-startups-race.html","A new wave of startups is attracting venture capital to build smaller, more advanced satellite constellations for applications ranging from Earth observation to global internet connectivity."
"Corporate Debt Wall: Trillions in Loans Are Coming Due in a High-Rate World",Business,"Liz McCormick",2024-02-23,Bloomberg,"https://www.bloomberg.com/news/articles/2024-02-23/corporate-debt-wall-trillions-coming-due-high-rates","Companies that borrowed cheaply over the last decade face a significant challenge as they must now refinance trillions of dollars in debt at much higher interest rates, threatening profitability."
"Return-to-Office Mandates Meet Resistance as Employee Priorities Shift",Business,"Chip Cutter",2024-02-22,"The Wall Street Journal","https://www.wsj.com/articles/return-to-office-mandates-employee-resistance","Major corporations are enforcing stricter in-office policies, but face pushback from employees who value the flexibility of remote work, leading to a tense standoff over the future of the workplace."
"Fast Fashion Giant Shein Faces Renewed Scrutiny Over Labor Practices Ahead of IPO",Business,"Abha Bhattarai",2024-02-21,The Washington Post,"https://www.washingtonpost.com/business/2024/02/21/shein-ipo-labor-practices/","As online retailer Shein prepares for a potential blockbuster IPO, lawmakers and activists are raising fresh concerns about its opaque supply chain and allegations of forced labor."
"Automakers Delay EV Targets, Investing in Hybrids as a Bridge Technology",Business,"Nora Eckert",2024-02-20,Reuters,"https://www.reuters.com/business/autos-transportation/automakers-delay-ev-targets-invest-in-hybrids-2024-02-20/","Several major car manufacturers are revising their EV timelines and increasing investment in hybrid models to cater to consumer demand for fuel efficiency without the range anxiety of pure electrics."
"The Creator Economy Matures: Focus Shifts from Virality to Sustainable Business Models",Business,"Taylor Lorenz",2024-02-19,The Washington Post,"https://www.washingtonpost.com/technology/2024/02/19/creator-economy-business-models/","Top content creators are moving beyond ad revenue, building diversified businesses with merchandise, subscription services, and direct partnerships to create more stable income streams."
"The Global Shipping Industry Confronts Decarbonization Challenge",Business,"Costas Paris",2024-02-18,"The Wall Street Journal","https://www.wsj.com/articles/global-shipping-industry-decarbonization-challenge","Shipping companies are under pressure to invest billions in new, greener fuels like methanol and ammonia to meet international emissions targets, but the technology and infrastructure are still in early stages."
"India Emerges as a Key Alternative to China for Tech Manufacturing",Business,"Samy Adghirni",2024-02-17,Financial Times,"https://www.ft.com/content/india-tech-manufacturing-alternative-to-china","Companies like Apple and Samsung are significantly expanding their manufacturing operations in India, as global firms seek to de-risk their supply chains and diversify away from China."
"Office-to-Residential Conversions Prove Costly and Complex",Business,"Konrad Putzier",2024-02-16,"The Wall Street Journal","https://www.wsj.com/articles/office-to-residential-conversions-costly-complex","While converting empty office buildings into apartments is seen as a solution to housing shortages and high vacancies, developers are finding such projects are often financially unfeasible due to zoning and structural challenges."
"Corporate Carbon Offsets Under Fire for Failing to Deliver Climate Promises",Business,"Ben Elgin",2024-02-15,Bloomberg Green,"https://www.bloomberg.com/news/features/2024-02-15/corporate-carbon-offsets-fail-to-deliver-on-climate-promises","Investigations into the carbon offset market reveal that many projects are not delivering the emissions reductions they claim, prompting companies to rethink their climate strategies."
"The US Dollar's Strength Creates Headwinds for Multinational Corporations",Business,"Kate Duguid",2024-02-14,Reuters,"https://www.reuters.com/markets/currencies/us-dollar-strength-creates-headwinds-for-multinationals-2024-02-14/","A persistently strong U.S. dollar is hurting the earnings of American companies that do significant business overseas, as their foreign revenue translates into fewer dollars."
"Cybersecurity Insurance Premiums Skyrocket Amidst Wave of Ransomware Attacks",Business,"David Uberti",2024-02-13,"The Wall Street Journal","https://www.wsj.com/articles/cybersecurity-insurance-premiums-skyrocket-ransomware","The cost for businesses to insure themselves against cyberattacks has soared, and insurers are imposing stricter security requirements before they will even offer a policy."
"The Gig Economy Braces for New Labor Rules on Worker Classification",Business,"Lauren Kaori Gurley",2024-02-12,The Washington Post,"https://www.washingtonpost.com/business/2024/02/12/gig-economy-labor-rules-worker-classification/","A new Department of Labor rule makes it more difficult for companies like Uber and DoorDash to classify their workers as independent contractors, a change that could upend their business models."
"Nuclear Fusion Startups Attract Billions in Private Investment",Business,"Gregory Barber",2024-02-11,WIRED,"https://www.wired.com/story/nuclear-fusion-startups-private-investment/","Despite the immense scientific challenges, venture capitalists and tech billionaires are pouring money into a new generation of startups aiming to achieve commercial nuclear fusion."
"DTC Darling or Dud? Many Direct-to-Consumer Brands Struggle with Profitability",Business,"Hilary Milnes",2024-02-10,Vogue Business,"https://www.voguebusiness.com/story/dtc-brands-struggle-profitability-customer-acquisition","Many digitally native brands that grew rapidly on social media are now finding it difficult to achieve sustained profitability due to soaring customer acquisition costs."
"The Global Food Industry Grapples with the High Cost of Cocoa",Business,"Megan Durisin",2024-02-09,Bloomberg,"https://www.bloomberg.com/news/articles/2024-02-09/cocoa-prices-soar-to-record-highs-squeezing-chocolate-makers","Poor harvests in West Africa have sent cocoa prices to record highs, forcing chocolate manufacturers like Hershey and Mondelez to raise prices and shrink product sizes."
"SaaS Companies Shift Focus from 'Growth at All Costs' to Efficient Operations",Business,"Alex Wilhelm",2024-02-08,TechCrunch,"https://techcrunch.com/2024/02/08/saas-companies-shift-to-efficient-growth/","The era of cheap capital is over for software-as-a-service companies, who are now under intense pressure from investors to cut costs, streamline operations, and demonstrate a clear path to profitability."
"Autonomous Trucking Companies Begin Commercial Pilots on US Highways",Business,"Andrew J. Hawkins",2024-02-07,The Verge,"https://www.theverge.com/2024/2/7/24064123/autonomous-trucking-commercial-pilots-aurora-kodiak","Companies developing self-driving trucks are moving beyond testing and launching commercial pilot programs on major freight corridors, hauling goods for corporate clients with a safety driver present."
"The Battle for the Dashboard: Automakers and Tech Giants Clash Over In-Car Software",Business,"Tim Higgins",2024-02-06,"The Wall Street Journal","https://www.wsj.com/articles/automakers-vs-tech-giants-battle-for-the-dashboard","Car companies are increasingly developing their own in-car operating systems to control user data and create new revenue streams, pushing back against the dominance of Apple CarPlay and Android Auto."
"Global Tourism Rebounds to Pre-Pandemic Levels, but Spending Patterns Have Changed",Business,"Hannah Sampson",2024-02-05,The Washington Post,"https://www.washingtonpost.com/travel/2024/02/05/global-tourism-rebound-spending-patterns/","International travel has fully recovered, but tourists are now prioritizing experiences over goods and are more sensitive to pricing, shifting the dynamics of the travel industry."
"Vertical Farming Faces a Reality Check as Energy Costs Soar",Business,"Matt Simon",2024-02-04,WIRED,"https://www.wired.com/story/vertical-farming-reality-check-energy-costs/","The high-tech vertical farming industry, once hailed as the future of agriculture, is struggling with high electricity costs and economic viability, leading to bankruptcies and consolidation."
"The Rise of the Chief AI Officer (CAIO) in the Corporate C-Suite",Business,"Diane Brady",2024-02-03,Forbes,"https://www.forbes.com/sites/dianebrady/2024/02/03/the-rise-of-the-chief-ai-officer-caio/","As companies race to implement artificial intelligence, many are creating a new executive role—the Chief AI Officer—to oversee strategy, ethics, and implementation of AI technologies."
"Pharmaceutical Industry Under Pressure as Medicare Begins Price Negotiations",Business,"Bertha Coombs",2024-02-02,CNBC,"https://www.cnbc.com/2024/02/02/medicare-begins-drug-price-negotiations-pharma-impact.html","For the first time, the U.S. government is negotiating the prices of some top-selling drugs for Medicare, a landmark policy that could significantly impact the revenues of major pharmaceutical firms."
"Fintech Consolidation Heats Up as Startups Seek Scale and Profitability",Business,"Ryan Browne",2024-02-01,CNBC,"https://www.cnbc.com/2024/02/01/fintech-consolidation-heats-up-as-startups-seek-scale.html","With venture funding scarce, many smaller financial technology startups are being acquired by larger, more established players in a wave of consolidation sweeping the industry."
"US Electric Grid Needs Massive Upgrade to Handle EV and AI Power Demands",Business,"Jennifer Hiller",2024-01-31,"The Wall Street Journal","https://www.wsj.com/articles/us-electric-grid-upgrade-ev-ai-power-demand","The rapid growth of electric vehicles and energy-intensive AI data centers is putting immense strain on the aging U.S. power grid, creating an urgent need for multi-trillion-dollar investments."
"Corporate America's Skills Gap: Companies Invest in In-House Training and Apprenticeships",Business,"Vanessa Fuhrmans",2024-01-30,"The Wall Street Journal","https://www.wsj.com/articles/corporate-skills-gap-in-house-training-apprenticeships","Finding qualified workers with specific technical skills remains a major challenge, prompting large companies to create their own training programs and apprenticeships to build their future workforce."
"The Advertising Market Remains Soft Amid Economic Uncertainty",Business,"Suzanne Vranica",2024-01-29,"The Wall Street Journal","https://www.wsj.com/articles/advertising-market-soft-economic-uncertainty","Brands are remaining cautious with their advertising budgets, leading to a sluggish market for media companies and ad-tech firms that rely on marketing spending."
"Solid-State Batteries: The Next Frontier for Electric Vehicles?",Business,"William Wilkes",2024-01-28,Bloomberg,"https://www.bloomberg.com/news/articles/2024-01-28/solid-state-batteries-the-next-frontier-for-electric-vehicles","Automakers and startups are in a fierce race to commercialize solid-state batteries, which promise longer range, faster charging, and improved safety compared to current lithium-ion technology."
"Emerging Market Debt Becomes a Growing Concern for the Global Economy",Business,"Colby Smith",2024-01-27,Financial Times,"https://www.ft.com/content/emerging-market-debt-global-economy-concern","Several developing nations are at high risk of debt distress due to a combination of high interest rates, a strong dollar, and slowing economic growth, posing a risk to global financial stability."
"Biotech Funding Shows Signs of Life After a Prolonged Slump",Business,"Damian Garde",2024-01-26,STAT News,"https://www.statnews.com/2024/01/26/biotech-funding-shows-signs-of-life-after-slump/","After a deep two-year downturn, venture capital investment in the biotechnology sector is beginning to rebound, especially for companies in promising fields like obesity and gene editing."
"The Pet Economy Boom Cools as Consumers Cut Back on Discretionary Spending",Business,"Sarah Nassauer",2024-01-25,"The Wall Street Journal","https://www.wsj.com/articles/pet-economy-boom-cools-consumer-spending","After a pandemic-fueled surge, spending on premium pet food, toys, and services is slowing as inflation-conscious consumers pull back on non-essential purchases for their pets."
"CRISPR-Based Therapy Shows Success in Lowering 'Bad' Cholesterol in First Human Trial",Health,"Sharon Begley",2024-02-28,STAT News,"https://www.statnews.com/2024/02/28/crispr-therapy-lowers-cholesterol-human-trial/","A single-dose gene-editing therapy has successfully and durably lowered LDL cholesterol in a small human trial, signaling a potential new paradigm for preventing heart disease."
"Antibiotic Resistance Dubbed a 'Silent Pandemic' as Common Infections Become Untreatable",Health,"Maryn McKenna",2024-02-27,WIRED,"https://www.wired.com/story/antibiotic-resistance-silent-pandemic/","Public health officials are issuing stark warnings as the pipeline for new antibiotics runs dry, while drug-resistant bacteria are causing a growing number of deaths worldwide."
"Smartwatch ECG Feature Credited with Early Detection of Atrial Fibrillation",Health,"Nicole Wetsman",2024-02-26,The Verge,"https://www.theverge.com/2024/2/26/24082123/smartwatch-ecg-afib-detection-study","A large-scale study confirms that wearable devices can effectively screen for atrial fibrillation, a common heart arrhythmia, allowing for earlier intervention and stroke prevention."
"Shortages of ADHD Medications Like Adderall Persist, Leaving Patients Scrambling",Health,"Roni Caryn Rabin",2024-02-25,The New York Times,"https://www.nytimes.com/2024/02/25/health/adhd-medication-shortage-adderall.html","Ongoing manufacturing delays and soaring demand have created a chronic shortage of key ADHD drugs, causing significant disruption for millions of patients who rely on them."
"The Health Debate Over Daylight Saving Time: Experts Favor a Permanent Standard Time",Health,"Beth Mole",2024-02-24,Ars Technica,"https://arstechnica.com/science/2024/02/the-health-debate-over-daylight-saving-time/","Sleep scientists and medical associations argue that the annual switch to daylight saving time disrupts circadian rhythms and is linked to increased risks of heart attacks and accidents."
"AI Accelerates Drug Discovery, Cutting Years Off Development Timelines",Health,"Emily Mullin",2024-02-23,MIT Technology Review,"https://www.technologyreview.com/2024/02/23/1088765/ai-accelerates-drug-discovery/","Pharmaceutical companies are leveraging artificial intelligence to identify new drug targets and predict molecular behavior, dramatically speeding up the preclinical phases of research."
"Maternal Mortality Rates in the U.S. Continue to Rise, Disparities Worsen",Health,"Megan Schmidt",2024-02-22,NPR,"https://www.npr.org/sections/health-shots/2024/02/22/1233123456/us-maternal-mortality-rates-worsen","A new CDC report reveals that the rate of maternal deaths in the United States has continued to climb, with Black and Indigenous women facing a risk several times higher than that of white women."
"Liquid Biopsy' Blood Tests Show Promise for Multi-Cancer Early Detection",Health,"Daniela Hernandez",2024-02-21,"The Wall Street Journal","https://www.wsj.com/articles/liquid-biopsy-blood-tests-cancer-early-detection","Researchers are optimistic about the potential of blood tests that can screen for dozens of types of cancer simultaneously by detecting DNA fragments shed by tumors."
"PFAS 'Forever Chemicals' in Drinking Water Linked to a Host of Health Problems",Health,"Darryl Fears",2024-02-20,The Washington Post,"https://www.washingtonpost.com/health/2024/02/20/pfas-forever-chemicals-drinking-water/","Mounting evidence connects exposure to PFAS chemicals, which are widespread in U.S. water systems, to kidney cancer, immune system dysfunction, and developmental issues."
"World's First Malaria Vaccine Rollout Begins in Africa, a Landmark Public Health Moment",Health,"Jason Beaubien",2024-02-19,NPR,"https://www.npr.org/sections/goatsandsoda/2024/02/19/1232123456/malaria-vaccine-rollout-africa","The first-ever vaccine against malaria is being administered to children in Ghana, Malawi, and Kenya, a historic step in the fight against a disease that kills hundreds of thousands annually."
"The Rise of Drug-Resistant Fungi Poses a New Global Health Threat",Health,"Apoorva Mandavilli",2024-02-18,The New York Times,"https://www.nytimes.com/2024/02/18/health/drug-resistant-fungi-candida-auris.html","Invasive fungal infections, such as Candida auris, are becoming more common and harder to treat, with experts concerned about their spread in healthcare settings."
"Physician Burnout and Shortages Reach Critical Point in Primary Care",Health,"Phil Galewitz",2024-02-17,Kaiser Health News (KHN),"https://khn.org/news/article/physician-burnout-shortages-primary-care-crisis/","A combination of administrative burden, an aging workforce, and insufficient residency slots is creating a severe shortage of primary care doctors, impacting patient access to basic healthcare."
"New Research Explores How Gut Bacteria Influence Anxiety and Depression",Health,"Moises Velasquez-Manoff",2024-02-16,The New York Times Magazine,"https://www.nytimes.com/2024/02/16/magazine/gut-bacteria-anxiety-depression.html","Scientists are uncovering the complex ways the gut microbiome communicates with the brain, opening up potential new avenues for treating mood disorders through probiotics and diet."
"The Health Impact of Noise Pollution: More Than Just Annoyance",Health,"Sarah Zhang",2024-02-15,The Atlantic,"https://www.theatlantic.com/health/archive/2024/02/noise-pollution-health-impact/677456/","Chronic exposure to noise from traffic and urban environments is linked to a higher risk of hypertension, heart disease, and cognitive impairment, research shows."
"FDA Approves New RSV Vaccine for Older Adults Ahead of Respiratory Virus Season",Health,"Amanda D'Ambrosio",2024-02-14,MedPage Today,"https://www.medpagetoday.com/infectiousdisease/rsv/108765","A new vaccine to protect adults aged 60 and older from Respiratory Syncytial Virus (RSV), a common virus that can cause severe illness in the elderly, has received FDA approval."
"Xenotransplantation Advances as Pig Kidney Functions in Brain-Dead Patient for Over a Month",Health,"Linda Geddes",2024-02-13,The Guardian,"https://www.theguardian.com/science/2024/feb/13/xenotransplantation-pig-kidney-functions-brain-dead-patient","In a major step forward for cross-species organ transplantation, a genetically modified pig kidney has continued to function normally for a record 32 days in a human recipient."
"Debate Intensifies Over E-Cigarette Flavors and Their Role in Youth Vaping",Health,"Sheila Kaplan",2024-02-12,The New York Times,"https://www.nytimes.com/2024/02/12/health/vaping-ecigarettes-flavors-youth.html","Public health advocates are pushing for a federal ban on all flavored e-cigarette products, arguing they are a key driver of the youth vaping epidemic, while opponents claim they help adults quit smoking."
"Medical Misinformation on Social Media Endangers Public Health, Surgeon General Warns",Health,"Donell Harvin",2024-02-11,Scientific American,"https://www.scientificamerican.com/article/medical-misinformation-on-social-media-is-a-public-health-danger/","The U.S. Surgeon General has issued an advisory on the urgent threat of health misinformation, calling on tech platforms to take more aggressive action to curb its spread."
"The Link Between Poor Dental Health and Systemic Diseases Like Diabetes and Heart Disease",Health,"Dana G. Smith",2024-02-10,Elemental,"https://elemental.medium.com/the-link-between-dental-health-and-systemic-disease-a1b2c3d4e5","Research increasingly shows that chronic inflammation from gum disease can contribute to and worsen conditions throughout the body, including cardiovascular disease and diabetes."
"Childhood Food Allergies Are on the Rise; Researchers Investigate Why",Health,"Meghan Rosen",2024-02-09,Science News,"https://www.sciencenews.org/article/childhood-food-allergies-rise-research","The prevalence of food allergies in children has increased dramatically in recent decades, with scientists exploring the 'hygiene hypothesis' and the role of the microbiome as potential causes."
"The Science of Longevity: Researchers Identify Cellular Hallmarks of Aging",Health,"Carl Zimmer",2024-02-08,The New York Times,"https://www.nytimes.com/2024/02/08/science/longevity-aging-cellular-hallmarks.html","Scientists have identified key biological processes that drive aging, such as genomic instability and cellular senescence, leading to new drug development aimed at extending human healthspan."
"Mental Health Parity Laws Are Failing, Leaving Patients with Huge Bills",Health,"Lesley McClurg",2024-02-07,NPR,"https://www.npr.org/sections/health-shots/2024/02/07/1229123456/mental-health-parity-laws-failing","Despite laws requiring insurers to cover mental healthcare equally to physical healthcare, a government report finds that insurance companies routinely and improperly deny mental health claims."
"Air Pollution Particles Found in Brains, Raising Concerns About Dementia Risk",Health,"Max G. Levy",2024-02-06,Quanta Magazine,"https://www.quantamagazine.org/air-pollution-particles-found-in-brains-raising-dementia-risk-20240206/","New studies using advanced imaging techniques have shown that ultrafine particulate matter from air pollution can cross the blood-brain barrier, potentially triggering inflammation linked to Alzheimer's disease."
"Robotic Surgery Becomes Standard for More Procedures, But Questions on Cost Remain",Health,"Christina Farr",2024-02-05,CNBC,"https://www.cnbc.com/2024/02/05/robotic-surgery-standard-of-care-cost-questions.html","Robot-assisted surgery is now common for procedures like prostatectomies and hysterectomies, offering precision and faster recovery, but its high cost remains a significant barrier for many hospitals."
"The Impact of Excessive Screen Time on Toddler Brain Development",Health,"Perri Klass, M.D.",2024-02-04,The New York Times,"https://www.nytimes.com/2024/02/04/well/family/screen-time-toddler-brain-development.html","A study published in JAMA Pediatrics finds that higher levels of screen time in toddlers are associated with differences in brain structure and poorer language and literacy skills."
"Global Polio Eradication Effort Faces Final Hurdles in Pakistan and Afghanistan",Health,"Joanne Silberner",2024-02-03,NPR,"https://www.npr.org/sections/goatsandsoda/2024/02/03/1228123456/polio-eradication-pakistan-afghanistan","After decades of work, wild poliovirus is now only endemic in two countries, but vaccine hesitancy and political instability are complicating the final push to eradicate the disease."
"Community Health Workers Bridge Gaps in Care for Underserved Populations",Health,"Bram Sable-Smith",2024-02-02,Kaiser Health News (KHN),"https://khn.org/news/article/community-health-workers-bridge-gaps-in-care/","A growing movement is integrating trusted local community health workers into the healthcare system to help patients navigate complex services and manage chronic conditions."
"Advancements in Prosthetics: Mind-Controlled Limbs Offer New Hope for Amputees",Health,"David Cox",2024-02-01,BBC Future,"https://www.bbc.com/future/article/20240201-mind-controlled-prosthetic-limbs-for-amputees","Next-generation prosthetic limbs that integrate with the user's nervous system are allowing for more intuitive, thought-driven control and even a sense of touch."
"Preventative Care: Why a Small Investment Can Yield Huge Health Savings",Health,"Aaron E. Carroll",2024-01-31,The New York Times,"https://www.nytimes.com/2024/01/31/upshot/preventative-care-health-savings.html","Economists and public health experts argue that increased investment in preventative services like screenings and vaccinations is highly cost-effective and leads to better long-term health outcomes."
